scheduled_ist,text,media_path,alt_text,url,status
"2025-08-28 16:55","","media_x/131B0838-F23F-439D-BE3D-21777EC0DDCC.png","","","pending"
"2025-08-22 13:34","From dash","media_x/B35D77D8-B8BE-4B9D-8E9F-CEFFBDA5861E.png","Photo","Pixeratools.com","posted 2025-08-22 13:36:00 ist"
"2025-08-22 10:52","Annotate like a pro: arrows, highlights, callouts… all consistent with your brand.","media_x/screenshot3.png","Annotation tools (arrows, highlights, callouts)","https://apps.apple.com/app/id6749479235?utm_source=x&utm_campaign=media3","posted 2025-08-22 11:41:00 ist"
"2025-08-22 11:55","Perfect App Store images: safe margins, crisp text, and eye-catching backgrounds.","media_x/screenshot6.png|media_x/screenshot6.png","App Store-ready composition with margins","https://pixeratools.com/?utm_source=x&utm_campaign=media6","posted 2025-08-22 15:39:00 ist"
"2025-08-22 10:54","One-click presets for speed. No more nudging shadows, radii, or spacing by hand.","media_x/ano.mp4","One-click preset applied to a screenshot","https://apps.apple.com/app/id6749479235?utm_source=x&utm_campaign=media5","posted 2025-08-22 15:42:00 ist"
